source,custom_id,author,index,table_content
Gutenberg,Youngman__Phillip_M___1927_-37317_GeographicVariationin.txt-2,Youngman Phillip M  1927 ,,"TABLE 1. MEASUREMENTS, IN MILLIMETERS, OF THOMOMYS BOTTAE Unless otherwise noted, specimens are adults from Colorado Key to Headings: A: Catalog number or number of individuals averaged B: Total length C: Tail D: Hind foot E: Condylobasal length F: Nasal length G: Zygomatic breadth H: Squamosal breadth I: Length of rostrum J: Breadth of rostrum K: Alveolar length of upper max. tooth-row L: Least interorbital breadth =============================================================== Sex             ---+---------+---+---+---+----+----+----+----+----+----+---+--- Thomomys bottae howelli, holotype ---+---------+---+---+---+----+----+----+----+----+----+---+--- F 75684 sad. 219 71 29 37.3 11.1 23.7 20.0 14.5 8.5 7.7 6.6 +---+---+---+----+----+----+----+----+----+---+--- Thomomys bottae aureus, Bedrock +---+---+---+----+----+----+----+----+----+---+--- F 2982 217 59 31 40.4 13.8 24.3 20.6 16.7 8.6 9.2 6.8 F 3013 210 60 29 38.7 13.0 24.4 20.4 15.7 8.1 8.9 7.0 M 2997 242 73 33 44.7 15.4 28.4 22.8 15.7 10.1 9.0 7.2 ---+---------+---+---+---+----+----+----+----+----+----+---+--- Coventry +---+---+---+----+----+----+----+----+----+---+--- F 6 av. 222 61 31 39.0 12.1 25.4 20.3 15.2 7.8 8.2 6.8 Max. 229 63 33 40.0 12.8 25.8 20.6 15.6 8.2 8.5 7.0 Min. 217 58 30 38.3 11.4 25.0 19.3 14.7 7.5 8.0 6.6 M 3 av. 259 70 35 46.5 15.0 29.3 22.7 17.8 9.2 9 5 6.7 Max. 270 76 36 48.3 16.0 31.9 23.7 18.0 9.3 9.6 6.9 Min. 250 65 35 45.5 14.4 27.6 22.2 17.6 9.2 8.0 6.4 ---+---------+---+---+---+----+----+----+----+----+----+---+--- Ashbaugh's Ranch and 15 mi. W Cortez +---+---+---+----+----+----+----+----+----+---+--- F 7 av. 225 67 28 39.0 13.7 24.4 20.2 16.1 8.0 8.3 6.3 Max. 238 75 31 40.6 14.7 25.0 20.7 16.5 8.5 8.7 6.8 Min. 216 55 26 37.8 12.9 23.6 19.7 15.5 7.8 7.9 6.1 M 4 av. 247 73 31 44.2 15.9 27.7 22.1 18.6 9.2 8.4 6.4 Max. 252 80 34 45.2 16.7 28.8 22.3 19.8 9.6 8.8 6.7 Min. 244 67 30 43.7 15.5 27.0 21.7 18.0 8.8 8.0 6.2 ---+---------+---+---+---+----+----+----+----+----+----+---+--- Cortez +---+---+---+----+----+----+----+----+----+---+--- F 5120 224 56 28 38.1 12.3 .... 19.5 15.4 7.5 7.6 6.5 5121 220 68 31 38.3 11.6 24.2 19.6 15.1 7.6 8.0 6.7 M 5124 257 81 33 44.4 15.4 29.5 22.2 18.6 8.9 8.6 6.5 M 5119 215 62 28 42.0 14.0 27.9 22.1 17.9 8.2 8.6 6.4 ---+---------+---+---+---+----+----+----+----+----+----+---+--- Mesa Verde (combined) +---+---+---+----+----+----+----+----+----+---+--- F 5 av. 221 63 30 39.0 12.6 24.7 20.2 16.0 8.0 8.2 6.7 Max. 235 66 32 40.4 13.7 25.6 21.1 17.3 8.7 8.5 7.1 Min. 212 61 28 38.1 12.0 24.1 19.5 15.0 7.7 7.9 6.4 M 3 av. 246 74 32 43.7 14.9 27.8 22.3 18.3 8.8 8.9 6.6 Max. 252 79 33 45.0 15.2 28.4 23.0 18.5 9.0 9.0 6.8 Min. 238 69 31 42.0 14.7 27.5 21.2 18.2 8.7 8.9 6.3 ---+---------+---+---+---+----+----+----+----+----+----+---+--- 1 mi. N La Plata +---+---+---+----+----+----+----+----+----+---+--- M 72966 236 70 31 45.4 15.6 29.4 23.3 20.2 8.8 8.5 6.5 ---+---------+---+---+---+----+----+----+----+----+----+---+--- 3 mi. W Durango +---+---+---+----+----+----+----+----+----+---+--- F 3 av. 225 65 28 40.1 13.1 25.7 21.0 16.6 8.1 8.3 6.5 Max. 230 67 29 40.4 13.5 25.8 21.2 16.8 8.4 8.5 6.6 Min. 219 63 28 39.9 13.0 25.7 20.6 16.5 8.4 8.1 6.4 M 70054 262 87 35 45.0 15.6 27.9 22.7 19.7 9.3 9.8 6.4 M 70055 248 79 31 43.3 14.0 27.6 22.1 17.1 8.7 8.2 6.2 ---+---------+---+---+---+----+----+----+----+----+----+---+--- 12 mi. W Pagosa Springs +---+---+---+----+----+----+----+----+----+---+--- F 72971 217 65 27 39.1 12.8 .... 20.0 15.4 7.4 8.7 6.2 M 72970 238 70 29 42.7 15.0 27.5 21.8 17.2 8.8 8.3 6.5 ---+---------+---+---+---+----+----+----+----+----+----+---+--- Thomomys bottae pervagus, Antonito +---+---+---+----+----+----+----+----+----+---+--- F 133668 sad. 208 69 29 37.3 12.9 23.1 18.2 15.8 7.5 8.0 6.9 ---+---------+---+---+---+----+----+----+----+----+----+---+--- Espanola, New Mexico +---+---+---+----+----+----+----+----+----+---+--- F 133616 249 82 38 41.1 .... 24.6 20.0 16.3 8.2 8.1 7.1 F 133619 216 65 32 40.6 .... 24.9 19.3 .... 8.0 8.0 6.8 M 58293 244 76 31 44.0 16.1 26.9 21.2 18.3 8.8 8.1 6.6 ---+---------+---+---+---+----+----+----+----+----+----+---+--- Thomomys bottae internatus, Salida +---+---+---+----+----+----+----+----+----+---+--- F 11 av. 219 67 31 38.6 13.4 23.2 19.5 15.4 7.6 7.8 6.5 Max. 242 80 34 40.4 14.2 25.0 20.2 16.2 8.1 8.4 6.9 Min. 196 45 29 37.6 12.9 21.9 18.8 14.8 7.3 7.0 6.3 M 3 av. 247 74 32 42.9 16.1 25.1 20.9 18.0 8.2 8.0 6.3 Max. 248 74 33 43.7 16.3 26.4 21.7 18.1 8.8 8.1 6.4 Min. 247 74 32 42.2 15.9 25.8 20.5 17.9 7.9 7.9 6.3 ---+---------"
Gutenberg,Duckworth__W__L__H___Wynfrid_Laurence_Henry_-44331_Prehistoricman.txt-0,Duckworth W L H  Wynfrid Laurence Henry ,,"TABLE B. List of types of associated implements. +------------------------+-------------+-------------+--------------+ 1908 1908 1903 Penck's scheme +-------------+-------------+--------------+ Boule Penck Hoernes +------------------------+---- -------+-------------+--------------+ Postglacial =4= = with Magdalenian Magdalenian -- Achen and other Solutréan(4) oscillations (Penck) =============++ =Glacial IV= 2nd Mousterian Solutréan -- Pleistocene(2)  Glaciation of Boule. ++============++ ""Würmian"" of Penck Interglacial =3= Acheulean Mousterian Magdalenian = Riss-Würm interval (Obermaier) (warm phase) (Penck) Chellean =Glacial III= 1st Chellean Mousterian -- Pleistocene Glaciation (cold phase) of Boule. ""Rissian"" of Penck Interglacial =2= ? Acheulean Solutréan = Mindel-Riss interval Chellean ++============= (Penck) =Glacial II= ? ? -- ""Mindelian"" of Penck Interglacial =1= ? ? Mousterian = Günz-Mindel interval Chellean (Penck) =Glacial I= ""Günzian"" ? ? -- of Penck +------------------------+-------------+-------------+--------------+ +------------------------+--------------+------------+-----------------+ 1908 1908 1878 Penck's scheme +--------------+------------+-----------------+ Rutot Sollas Skertchley +------------------------+--------------+------------+-----------------+ Postglacial =4= = with Neolithic ? Neolithic Achen and other period period oscillations (Penck) =Glacial IV= 2nd Lower ? Hessle Pleistocene(2) Magdalenian Boulder-clay Glaciation of Boule. Solutréan ""Würmian"" of Penck Aurignacian Interglacial =3= Mousterian Acheulean Palaeoliths = Riss-Würm interval Upper of the (Penck) Acheulean ""modern-valley"" type. Valley-gravels of present Ouse, Cam, etc. =Glacial III= 1st Lower  of Penck Interglacial =2= Strépyan ? Palaeoliths of = Mindel-Riss interval Mesvinian ""ancient-valley"" (Penck) Mafflean type. ?Flood-gravels. Valleys do not correspond to modern river =Glacial II= -- ? Chalky ""Mindelian"" of Penck Boulder-clay Interglacial =1= -- ? Brandon beds = Günz-Mindel interval with implements (Penck) =Glacial I= ""Günzian"" -- ? Cromer Till. of Penck Later than Forest-Bed +------------------------+--------------+------------+-----------------"
Gutenberg,Fisher__Joseph__F_R_H_S_-3799_LandholdinginEngland.txt-14,Fisher Joseph F R H S ,,"PRODUCTION OF FOOD. The land of England and Wales in 1696 and 1874 was classified as follows: 1696. 1874. Acres. Acres. Under grain, 10,000,000 8,021,077 Pastures and meadows, 10,000,000 12,071,791 Flax, hemp, and madder, 1,000,000 --------- Green crops, --------- 2,895,138 Bare fallow, --------- 639,519 Clover --------- 2,983,733 Orchards, 1,000,000 148,526 Woods, coppices, etc, 3,000,000 1,552,598 Forests, parks, and commons, 3,000,000 Moors, mountains, and bare land, 10,000,000 - 9,006,839 Waste, water, and road, 1,000,000 ----------- -----------"
Gutenberg,Casseday__Ben-38740_TheHistoryof.txt-13,Casseday Ben,,"TABLE OF CHURCHES. -------------------------------------------------------------------- Congregations. +-------------------------------------- Communications. +----------------------------- Number in Congregation. (Attendance.) +-------------------- Church Accomodations for +----------- Value of CHURCHES. Property. ------------------- --------- -------- -------- -------- ----------- BAPTIST 5 1,729 2,200 2,650 80,000 EPISCOPAL 3 431 1,425 2,150 76,000 METHODIST 17 3,036 5,900 8,250 109,000 PRESBYTERIAN 5 913 2,225 3,300 128,000 GERMAN EVANGELICAL 4 1,200 2,150 21,700 "" LUTHERAN 1 100 100 "" REFORMED 1 75 200 200 2,250 DISCIPLE 2 410 520 950 18,000 UNITARIAN 1 63 240 320 12,000 UNIVERSALIST 1 70 200 500 8,000 ROMAN CATHOLIC 4 5,000 5,000 3,540 125,000 JEWS 2 400 400 11,000 --------- -------- -------- -------- ----------- Total 46 11,727 19,610 24,510 590,900 --------------------------------------------------------------------"
Gutenberg,Cooley__M__S___Maxwell_Stephens___1874_-70409_Vacuumcleaningsystems.txt-11,Cooley M S  Maxwell Stephens  1874 ,,"TABLE 20. PRESSURE LOSSES FROM INLET TO SEPARATOR IN SYSTEM FOR CLEANING RAILROAD CARS. --------+---------+----------+---------+--------+--------+-------- Average Friction Final Cubic Ft. Equivalent Size of Vacuum, Loss, Vacuum, Section Free Air Length, Pipe, Ins. Ins. Ins. of Pipe. per min. feet. In. Diam. Mercury. Mercury. Mercury. --------+---------+----------+---------+--------+--------+-------- x--5 60 150 2¹ ₂ 6 0.35 6.35 5--4 120 140 2¹ ₂ 7 1.35 7.70 4--2 180 280 2¹ ₂ 11 7.0 14.70 2--w 180 190 3 16 4.0 18.70 w--u 360 20 5 19 0.9 19.60 u--s 480 20 6 20 0.5 20.10 s--sep 600 20 6 20 0.4 20.50 --------+---------+----------+---------+--------+--------+--------"
Gutenberg,Getman__Frederick_Hutton-32974_TheElementsof.txt-4,Getman Frederick Hutton,,BEHAVIOR OF SUBSTANCE ---------------------------------------------------------------------------- Before Bp. Before Bp. In ignition In flame In flame After first on Ch. on Ch. with tube with on with borax ignition alone Na{2}CO{3} Na{2}CO{3} platinum bead with and Ch. wire Co(NO{3}){2} ---------------------------------------------------------------------------- ---------------------------------------------------------------------------- Remarks Substance ----------------------------------------------------------------------------
Gutenberg,Getman__Frederick_Hutton-32974_TheElementsof.txt-8,Getman Frederick Hutton,,BEHAVIOR OF SUBSTANCE ---------------------------------------------------------------------------- Before Bp. Before Bp. In ignition In flame In flame After first on Ch. on Ch. with tube with on with borax ignition alone Na{2}CO{3} Na{2}CO{3} platinum bead with and Ch. wire Co(NO{3}){2} ---------------------------------------------------------------------------- ---------------------------------------------------------------------------- Remarks Substance ----------------------------------------------------------------------------
Gutenberg,Getman__Frederick_Hutton-32974_TheElementsof.txt-1,Getman Frederick Hutton,,TABLE OF COLORS OF COATINGS ON CHARCOAL -------------------------------------------------- Element Color Hot Color Cold --------- ------------------------ --------------- Antimony (Rather volatile) White Arsenic (Very volatile) White Bismuth Orange-Yellow Lemon-Yellow Cadmium Brownish Yellow Reddish Brown Lead Lemon-Yellow (volatile) Lemon-Yellow Silver Dark Red Dark Red Tin Faint Yellow White Zinc Yellow White -------------------------------------------------- II TABLE OF FLAME COLORATIONS ------------------------------------ Red Yellow Green ------------- ---------- ----------- Calcium Sodium Barium Lithium Boron Strontium Iodine ------------- ---------- ----------- Bluish Green Blue Violet ------------- ---------- ----------- Bromine Chlorine Potassium Copper Phosphorus ------------------------------------ III TABLE OF COLORS OF BORAX BEADS IN OXIDIZING FLAME --------------------------------------------------------- Element Color Hot Color Cold --------- ------------------------ --------------------- Aluminum Colorless to Cloudy Colorless to Cloudy Antimony Yellowish Colorless Barium Colorless to Opaque Colorless to Opaque Bismuth Yellow Colorless Cadmium Yellow Colorless to White Calcium Colorless Colorless Chromium Reddish Yellow Yellowish Green Cobalt Blue Blue Copper Green Greenish Blue Iron Orange Yellow Lead Yellow Colorless Magnesium Colorless Colorless Manganese Violet Reddish Violet Nickel Violet Reddish Brown Silver Colorless Milk-White Strontium Colorless to Opaque Colorless to Opaque Tin Colorless Colorless Zinc Yellowish Colorless --------------------------------------------------------- IV TABLE OF COLORS OF BORAX BEADS IN REDUCING FLAME ------------------------------------------------ Element Color Hot Color Cold ------------------------------------------------ Aluminum Colorless Colorless Antimony Colorless Cloudy Barium Colorless Colorless Bismuth Colorless Gray--Cloudy Cadmium Colorless Gray--Cloudy Calcium Colorless Colorless Chromium Green Green Cobalt Blue Blue Copper Colorless Red Iron Yellowish Green Yellowish Green Lead Colorless Gray Magnesium Colorless Colorless Manganese Colorless Pink Nickel Colorless Gray--Cloudy Silver Colorless Gray Strontium Colorless Colorless Tin Colorless Colorless Zinc Colorless Gray ------------------------------------------------ V TABLE OF COLORS OF MICROCOSMIC SALT BEADS IN OXIDIZING FLAME --------------------------------------------------- Element Color Hot Color Cold --------------------------------------------------- Aluminum Colorless Colorless Antimony Yellowish Colorless Barium Colorless to Opaque Colorless to Opaque Bismuth Yellow Colorless Cadmium Yellowish Colorless Calcium Colorless Colorless to Opaque Chromium Reddish Green Cobalt Blue Blue Copper Green Greenish Blue Iron Red Brownish Red Lead Yellowish Colorless Magnesium Colorless Colorless Manganese Brownish Violet Reddish Violet Nickel Reddish Yellow Silver Yellowish Yellowish Strontium Colorless Colorless Tin Colorless Colorless Zinc Yellowish Colorless --------------------------------------------------- VI TABLE OF COLORS OF MICROCOSMIC SALT BEADS IN REDUCING FLAME +-----------+-------------+--------------+ Element Color Hot Color Cold -----------+-------------+--------------
Gutenberg,Fothergill__John-54911_AnAccountof.txt-5,Fothergill John,,FINIS. -----
Gutenberg,Brace__James_H_-19037_Transactionsofthe.txt-4,Brace James H ,,"TABLE 1.--PROGRESS AND METHODS OF EXCAVATION IN GOOD GROUND. THIRTY-THIRD STREET. ============================================================ 1 2 3 -----------------------------+--------+--------------------+ Type of excavation. Tunnels. Worked from: -----------------------------+--------+--------------------+ Full-sized single tunnel B 1st Ave. shaft. Full-sized single tunnel A 1st Ave. shaft. Full-sized twin tunnel A and B 1st Ave. shaft. Full-sized twin tunnel A and B Intermediate shaft. (West of shaft.) Full-sized twin tunnel A and B Intermediate shaft. (East of shaft.) Full-sized twin tunnel A and B Intermediate shaft. (East of shaft.) Exploration drift A and B Intermediate shaft. (West of shaft.) Twin tunnel. Enlargement A and B West shaft. of exploration drift (East of shaft.) =============================+========+===================== ====================================================================== 4 5 6 7 ----------------------------------+--------+------------+------------+ Length Average DATES. Time tunnel advance ---------------------------------- elapsed, excavated, per day, in in in From To days. linear feet. linear feet. ----------------------------------+--------+------------+------------+ Feb. 28, 1906. May 12, 1906. 74 346 4.7 Feb. 28, 1906. Apr. 30, 1906. 62 255 4.1 Aug. 23, 1906. Jan. 5, 1907. 136 789 5.8 Apr. 4, 1906. Oct. 31, 1906. 210 730 3.5 Apr. 4, 1906. Oct. 31, 1906. 210 783 3.7 Nov. 1, 1906. Dec. 26, 1906. 56 311 5.5 Mar. 1, 1907. July 23, 1907. 145 947 6.5 Sept. 6, 1907. Dec. 4, 1907. 89 603 6.8 ===============+==================+========+============+============= ===================================================== 8 ----------------------------------------------------- Methods and conditions. ----------------------------------------------------- Top heading and bench. Muck loaded by hand. "" "" "" "" "" "" "" "" Top full-width heading and bench. Muck loaded by steam shovel. Working exclusively on this heading. Top center heading and bench. Muck loaded by steam shovel. Working alternately in headings east and west of the shaft. Top center heading and bench. Muck loaded by steam shovel. Working alternately in headings east and west of the shaft. Top full-width heading and bench. Muck loaded by steam shovel working exclusively on this heading. Exploration drift about 9 ft. by 12 ft. Mucking by hand. Fourteen timber bents were placed in March, and seven in April, 1907. Drift excavated to full width and bench. Muck loaded by steam shovel. ===================================================== THIRTY-SECOND STREET. ============================================================ 1 2 3 -----------------------------+--------+--------------------+ Type of excavation. Tunnels. Worked from: -----------------------------+--------+--------------------+ Full-sized single tunnel C 1st Ave. shaft. Full-sized single tunnel D 1st Ave. shaft. Full-sized twin tunnel C and D 1st Ave. shaft. Narrowed twin tunnel C Intermediate shaft. (East of shaft.) Narrowed twin tunnel C Intermediate shaft. (East of shaft.) Full-sized twin tunnel C and D Intermediate shaft. (West of shaft.) Exploration drift C and D Intermediate shaft. (West of shaft.) Twin tunnel. Enlargement } C and D { Eastward from of exploration drift } { open cut. Twin tunnel. Enlargement } C and D { Eastward from of exploration drift } { open cut. =============================+========+===================== ==================================+========+============+============= 4 5 6 7 ----------------------------------+--------+------------+------------+ Length Average DATES. Time tunnel advance ---------------------------------- elapsed, excavated, per day, in in in From To days. linear feet. linear feet. ----------------------------------+--------+------------+------------+ Jan. 25, 1906. Apr. 30, 1906. 95 367 3.9 Jan. 27, 1906. Apr. 30, 1906. 93 354 3.8 {May. 22, 1906. July 24, 1906.} 173 810 4.7 {Aug. 11, 1906. Nov. 29, 1906. } Mar. 19, 1906. May 28, 1906. 70 58 0.8 {May 29, 1906. July 3, 1906.} 208 1,206 5.8 {July 18, 1906. July 31, 1906. } {Aug. 12, 1906. Nov. 23, 1906. } {Jan. 15, 1907. Feb. 5, 1907. } {Feb. 17, 1907. Mar. 21, 1907. } Dec. 1, 1905. May. 10, 1906. 161 225 1.4 Feb. 1, 1907. Sept.13, 1907. 225 1,033 4.6 }Feb. 1, 1908. Feb. 14, 1908. 14 65 4.6 } }Feb. 15, 1908. Apr. 14, 1908. 59 524 8.9 } ======================================================================  ======================================================= 8 ------------------------------------------------------- Methods and conditions. ------------------------------------------------------- Top heading and bench. Muck loaded by hand. "" "" "" "" "" "" "" "" Double heading and bench. Muck loaded by steam shovel. Stretches aggregating 200 ft. narrowed to about 25 ft. and later enlarged are included. Excavation about 30 ft. wide. Top full-width heading and bench. Muck loaded by hand. Steam shovel not installed. Excavation about 30 to 35 ft. wide. Top full-width by hand and part by steam shovel. Double heading and bench. Part of the muck handled by hand and part by steam shovel. Exploration drift about 10 ft. by 13 in. Muck loaded by hand. 14 ft. timbered. At portal of twin tunnels. Drift excavated to full width and bench. Muck loaded by hand. 12 ft. timbered. Drift excavated to full width and bench. Muck loaded by steam shovel. Full-width tunnel timbered for 26 ft. independently of the main excavation. ======================================================="
Gutenberg,Brace__James_H_-19037_Transactionsofthe.txt-1,Brace James H ,,"TABLE 1.--PROGRESS AND METHODS OF EXCAVATION IN GOOD GROUND. THIRTY-THIRD STREET. ============================================================ 1 2 3 -----------------------------+--------+--------------------+ Type of excavation. Tunnels. Worked from: -----------------------------+--------+--------------------+ Full-sized single tunnel B 1st Ave. shaft. Full-sized single tunnel A 1st Ave. shaft. Full-sized twin tunnel A and B 1st Ave. shaft. Full-sized twin tunnel A and B Intermediate shaft. (West of shaft.) Full-sized twin tunnel A and B Intermediate shaft. (East of shaft.) Full-sized twin tunnel A and B Intermediate shaft. (East of shaft.) Exploration drift A and B Intermediate shaft. (West of shaft.) Twin tunnel. Enlargement A and B West shaft. of exploration drift (East of shaft.) =============================+========+===================== ====================================================================== 4 5 6 7 ----------------------------------+--------+------------+------------+ Length Average DATES. Time tunnel advance ---------------------------------- elapsed, excavated, per day, in in in From To days. linear feet. linear feet. ----------------------------------+--------+------------+------------+ Feb. 28, 1906. May 12, 1906. 74 346 4.7 Feb. 28, 1906. Apr. 30, 1906. 62 255 4.1 Aug. 23, 1906. Jan. 5, 1907. 136 789 5.8 Apr. 4, 1906. Oct. 31, 1906. 210 730 3.5 Apr. 4, 1906. Oct. 31, 1906. 210 783 3.7 Nov. 1, 1906. Dec. 26, 1906. 56 311 5.5 Mar. 1, 1907. July 23, 1907. 145 947 6.5 Sept. 6, 1907. Dec. 4, 1907. 89 603 6.8 ===============+==================+========+============+============="
Gutenberg,Brace__James_H_-18722_Transactionsofthe.txt-7,Brace James H ,,"TABLE 2.--RATE OF PROGRESS, NATURE OF MATERIALS, AND METHODS ADOPTED IN CONSTRUCTION OF EAST RIVER TUNNELS. LINE A, LONG ISLAND. --------------+-----------------+-------------------+-------------------------+ Station: Date: ---------+---------+------------+------------+ Material. Method. From To From To --------------+-----------------+---------+---------+------------+------------+ All rock Bottom heading 69+39.9 69+79 Aug. 2, '06 Sept 25, '06 All rock Center heading 69+79 70+64 Sept 25, '06 Nov. 21, '06 Earth and rock Center heading 70+64 71+34 Nov. 21, '06 Dec. 30, '06 Earth and rock Bottom heading 71+34 71+89 Dec. 30, '06 Feb. 13, '07 All rock Bottom heading 71+89 72+11 Feb. 13, '07 Feb. 21, '07 Earth and rock Center heading 72+11 72+67 Feb. 21, '07 Mar. 19, '07 All rock Center heading 72+67 76+54 Mar. 19, '07 Sept 6, '07 Earth and rock Going out of rock 76+54 77+24 Sept 6, '07 Oct. 4, '07 All earth Soft ground 77+24 90+57.3 Oct. 4, '07 Mar. 26, '08 --------------+-----------------+---------+---------+------------+------------+ --------------+------+--------+--------+--------------------------------------+ Rate of Number progress of Linear in feet Material. days. feet. per day. Remarks --------------+------+--------+--------+--------------------------------------+ All rock 54 39.1 0.724 All rock 57 85 1.49 Earth and rock 39 70 1.79 Earth and rock 45 55 1.22 All rock 8 22 2.75 Earth and rock 26 56 2.15 All rock 171 387 2.26 Earth and rock 28 70 2.50 All earth 174 1,333.3 7.66 --------------+------+--------+--------+--------------------------------------+ LINE B, LONG ISLAND. --------------+-----------------+-------------------+-------------------------+ Station: Date: ---------+---------+------------+------------+ Material. Method. From To From To --------------+-----------------+---------+---------+------------+------------+ All rock Bottom heading 69+29.6 70+46 Oct. 16, '06 Nov. 20, '06 Earth and rock Bottom heading 70+46 71+95 Nov. 20, '06 Feb. 23, '07 All rock Bottom heading 71+95 72+25 Feb. 23, '07 Mar. 6, '07 Earth and rock Center heading 72+25 72+60 Mar. 6, '07 Mar. 24, '07 All rock Going out of rock 72+60 76+57 Mar. 24, '07 Aug. 7, '07 Earth and rock Soft ground 76+57 77+30 Aug. 7, '07 Sept 5, '07 All earth Soft ground 77+30 90+49.6 Sept 5, '07 Mar. 19, '08 --------------+-----------------+---------+---------+------------+------------+ --------------+------+--------+--------+--------------------------------------+ Rate of Number progress of Linear in feet Material. days. feet. per day. Remarks --------------+------+--------+--------+--------------------------------------+ All rock 35 116.4 3.33 Earth and rock 95 149 1.57 All rock 11 30 2.73 Earth and rock 18 35 1.94 All rock 136 397 2.92 Earth and rock 29 73 2.52 All earth 196 1,319.6 6.73 --------------+------+--------+--------+--------------------------------------+ LINE C, LONG ISLAND. --------------+-----------------+-------------------+-------------------------+ Station: Date: ---------+---------+------------+------------+ Material. Method. From To From To --------------+-----------------+---------+---------+------------+------------+ All rock Bottom heading 68+61.9 69+93 June 11, '06 Oct. 16, '06 Earth and rock Bottom heading 69+93 71+65 Oct. 16, '06 Feb. 7, '07 All rock Bottom heading 71+65 71+91 Feb. 7, '07 Feb. 13, '07 All rock Center heading 71+91 75+81 Feb. 13, '07 July 20, '07 Earth and rock Going out of rock 75+81 76+56 July 20, '07 Aug. 25, '07 All earth Soft ground 76+56 90+44.4 Aug. 25, '07 Mar. 17, '08 --------------+-----------------+---------+---------+------------+------------+ --------------+------+--------+--------+--------------------------------------"
