source,custom_id,author,index,table_content
Gutenberg,Collet__Clara_E___Clara_Elizabeth_-68623_Educatedworkingwomen.txt-4,Collet Clara E  Clara Elizabeth ,,"LONDON. St. Shoreditch. Bethnal Whitechapel. Pancras. Green. +---------------+-------+--------+-----------+-------+------------+ =All ages= =182 4= =168 3= =151 8= =157 5= =172 2= 15-20 3,370 3,450 2,066 2,162 2,793 20-25 214 9 194 8 102 2 108 5 153 5 25-35 51 7 48 2 25 2 21 0 31 0 =35-45= =25 4= =24 4= =13 8= =9 4= =14 3= Unmarried } women to } 100 married } 22 2 21 3 12 0 8 6 12 2 women and } widows } 35-45 } +---------------+-------+--------+-----------+-------+------------"
Gutenberg,Stillman__William_James-62044_BillyandHans.txt-2,Stillman William James,,HUNDRED AND FIFTY COPIES OF THIS BOOK PRINTED ON VAN GELDER HAND-MADE PAPER AND THE TYPE DISTRIBUTED IN THE MONTH OF APRIL MDCCCCXIV  -----
Gutenberg,Wedmore__Frederick__Sir-68011_EtchinginEngland.txt-0,Wedmore Frederick Sir,,"COTMAN 22 VIII. SAMUEL PALMER 26 IX. JAMES MCNEIL WHISTLER 30 X. SIR SEYMOUR HADEN 45 XI. ALPHONSE LEGROS 62 XII. WILLIAM STRANG 71 XIII. CHARLES HOLROYD 87 XIV. FRANK SHORT 95 XV. C. J. WATSON 103 XVI. OLIVER HALL 115 XVII. COLONEL GOFF 119 XVIII. D. Y. CAMERON 137 XIX. JOSEPH PENNELL 140 XX. MORTIMER MENPES 144 XXI. L. RAVEN-HILL 148 XXII. R. W. MACBETH, HUBERT HERKOMER, R.A., AND AXEL HAIG 152 XXIII. SOME OTHER ETCHERS 159 XXIV. HELLEU 172 ILLUSTRATIONS. PAGE 1. TWICKENHAM (Frontispiece).....Turner 2. SEINE BRIDGE .....Girtin 7 3. THE RECEIPT.....Wilkie 11 4. PECKHAM RYE.....Geddes 15 5. HALLIFORD ON THAMES..... 17 6. NEAR WHITBY.....Cotman 23 7. THE HERDSMAN.....Samuel Palmer 27 8. THAMES POLICE.....Whistler 33 9. THE PIAZZETTA..... 39 10. TREE STUDY.....Seymour Haden 43 11. THOMAS HADEN, AFTER WRIGHT OF DERBY.....Seymour Haden 47 12. KIDWELLY TOWN..... 49 13. A WATER MEADOW..... 53 14. WINDMILL HILL..... 55 15. SCOTCH FIRS..... 59 16. COMMUNION DANS GLISE ST. MÉDARD.....Legros 63 17. LA MORT ET LE BÛCHERON..... 67 18. THE POTATO BASKET.....William Strang 73 19. THE BOOKSTALL..... 75 20. LORD JUSTICE LINDLEY..... 77 21. MIDNIGHT MASS, MONTE OLIVETO.....Charles Holroyd 81 22. FARM BEHIND SCARBOROUGH.....Charles Holroyd 83 23. ROUND TEMPLE..... 85 24. WROUGHT NAILS.....Frank Short 89 25. SLEEPING TILL THE FLOOD..... 91 26. QUARTER BOYS..... 93 27. MILL BRIDGE, BOSHAM.....C. J. Watson 99 28. ST. ETIENNE DU MONT..... 101 29. LANDSCAPE WITH TREES.....Oliver Hall 107 30. ROADSIDE TREES..... 109 31. TREES ON THE HILL-SIDE..... 111 32. THE EDGE OF THE FOREST..... 113 33. CHAIN PIER, BRIGHTON.....Colonel Goff 117 34. NORFOLK BRIDGE, SHOREHAM..... 123 35. PINE TREES, CHRISTCHURCH..... 127 36. BORDER TOWERS.....D. Y. Cameron 131 37. THE PALACE, STIRLING CASTLE..... 133 38. WINDMILLS, ZANDAAM..... 135 39. LE PUY EN VELAY.....Joseph Pennell 141 40. JAPANESE GIRLS.....Menpes 145 41. WANDLE RIVER.....L. Raven-Hill 149 42. GWENYDD.....Herkomer 153 43. THE OPEN WINDOW.....Elizabeth Armstrong 157 44. AT THE LOOM.....Minna Bolingbroke 161 45. DORKING.....Percy Thomas 163 46. SUNRISE IN WALES.....W. Holmes May 167 47. A HURRYING WIND.....Alfred East 169 48. ETUDE DE JEUNE FILLE.....Helleu 173 49. FEMME À LA TASSE..... 177 50. LE SALON BLANC....."
Gutenberg,Bose__Jagadis_Chandra-48280_LifeMovementsin.txt-17,Bose Jagadis Chandra,,"TABLE XIII.--EFFECT OF INCREASED INTERNAL HYDROSTATIC PRESSURE (Kysoor). +-----------+-----------------------+-------------------+ Specimen. Hydrostatic pressure. Rate of growth. +-----------+-----------------------+-------------------+ Normal 0.18 µ per second. No. I 2 cm. pressure 0.20 µ "" "" 4 cm. "" 0.11 µ "" "" Normal 0.13 µ "" "" No. II 1 cm. pressure 0.20 µ "" "" 3 cm. "" 0.18 µ "" "" 4 cm. "" 0.15 µ "" "" +-----------+-----------------------+-------------------+ RESPONSE TO NEGATIVE VARIATION OF TURGOR. I shall now describe the influence of induced diminution of turgor on the rate of growth.  Method of plasmolysis: Experiment 72.--Being desirous of demonstrating the responsive growth variations of opposite signs in an identical specimen under alternate increase and diminution of turgor, I continued the experiment with the same peduncle of Zephyranthes in which the growth acceleration was induced by irrigation with warm water. In that experiment the growth rate of 0.04 µ per second was enhanced to 0.20 µ per second after irrigation. A strong solution of KNO{3} was now applied at the root; and the growth-rate fell almost immediately to 0.03 µ per second, or nearly to one-third the previous rate, the depression induced being thus greater than under condition of drought (Fig. 71). TABLE XIV.--EFFECT OF ALTERNATE VARIATION OF TURGOR ON GROWTH (Zephyranthes). +--------------------------------+-------------------+ Condition of Experiment. Rate of growth. +--------------------------------+-------------------+ Dry soil 0.04 µ per second. Application of warm water 0.20 µ "" "" Steady growth after 1 hour 0.08 µ "" "" Application of KNO{3} solution 0.03 µ "" "" +--------------------------------+-------------------"
Gutenberg,Bose__Jagadis_Chandra-48280_LifeMovementsin.txt-17,Bose Jagadis Chandra,,"EFFECT OF EXTERNAL TENSION. Experiment 73.--The recording levers are at first so balanced that very little tension is exerted on the plant. Record of normal growth is taken of a specimen of Crinum. The tension is gradually increased from one gram to ten grams. The table given below shows how growth-rate increases with the tension till a limit is reached, after which there is a retardation. TABLE XV.--EFFECT OF TENSION ON GROWTH. +--------------+--------------------+ Tension. Rate of growth. +--------------+--------------------+ 0 (Normal) 0.41 µ per second. 4 grams 0.44 µ "" "" 6 "" 0.48 µ "" "" 8 "" 0.52 µ "" "" 10 "" 0.40 µ "" "" +--------------+--------------------"
Gutenberg,Bose__Jagadis_Chandra-48280_LifeMovementsin.txt-8,Bose Jagadis Chandra,,"TABLE XIX--ACCELERATING EFFECT OF INDIRECT STIMULUS ON GROWTH (Crinum). +----------+--------------------------+--------------------+ Specimen. Condition of experiment. Rate of growth. +----------+--------------------------+--------------------+ I Normal 0.21 µ per second. After Indirect stimulus 0.26 µ "" "" +----------+--------------------------+--------------------+ II Normal 0.25 µ "" "" After Indirect stimulus 0.30 µ "" "" +----------+--------------------------+--------------------"
Gutenberg,Bose__Jagadis_Chandra-48280_LifeMovementsin.txt-3,Bose Jagadis Chandra,,"TABLE 1--PERIODS OF MAXIMUM CONTRACTION AND OF RECOVERY OF DIFFERENT PLANTS. +-------------------------------------+-------------+------------+ Period of Period of Specimen maximum recovery. contraction +-------------------------------------+-------------+------------+ Radial organ: Tendril of Passiflora 100 seconds 4 minutes. Anisotropic organ: Hooked tendril of Passiflora 120 "" 13 "" Pulvinated organ: Pulvinus of Neptunia Oleracea 180 "" 57 "" Pulvinus of Mimosa pudica 3 "" 16 "" +-------------------------------------+-------------+------------"
Gutenberg,Alsop__George__1638_-57811_ACharacterof.txt-13,Alsop George 1638 ,,"FORME OF BINDING A SERVANT.  This indenture made the ...... day of .............. in the ......... yeere of our Soveraigne Lord King Charles &c betweene .............. of the one party, and .............. on the other party, Witnesseth that the said .............. doth hereby covenant, promise and grant to and with the said .............. his Executors and Assignes, to serve him from the day of the date hereof, vntill his first and next arrivall in Maryland, and after for and during the tearme of ...... yeeres, in such service and employment as the said .............. or his assignes shall there employ him, according to the custome of the countrey in the like kind. In consideration whereof, the said .............. doth promise and grant, to and with the said .............. to pay for his passing and to find him with Meat, Drinke, Apparell and Lodging, with other necessaries during the said terme; and at the end of the said terme, to give him one Whole yeeres provision of Corne and fifty acres of Land, according to the order of the countrey. In witnesse whereof, the said .............."
Gutenberg,Jones__Alfred_Stowell-56637_NaturalArtificial.txt-0,Jones Alfred Stowell,,SEPTIC TANK EXPERIMENTS. Rate of Flow and Deposition of Suspended Matters. -----+------------+-----------------------+ Rate of Flow. +-----------------------+ No. Name of Length of Velocity Town. Sojourn of Flow of Sewage per in Tank. minute. -----+------------+-----------+-----------+ days. inches. 1 Exeter 1 0 0 52 2 Manchester 0 44 5 58 3 0 56 4 44 4 Leeds 0 5 1 68 } 5 1 0 0 84 } 6 2 0 0 42 } -----+------------+-----------+-----------+ -----+----------------------------------------------- Suspended Matters in Sewage. -----------+-----------+------------+---------- No. Remaining Destroyed Leaving in and Tank Total. Tank. Liquefied in in Tank. Effluents. -----+-----------+-----------+------------+---------- per cent. per cent. per cent. 1 17 39 44 100 2 41 22 37 100 3 23 33 44 100 4 .. .. .. .. 5 average 28 .. .. say 6 .. .. .. -----+-----------+-----------+------------+----------
Gutenberg,Judd__Charles_Hubbard-56903_Introductiontothe.txt-15,Judd Charles Hubbard,,"TABLE VI. PERCENTAGES OF FAILURES IN THE CHIEF SUBJECTS OF INSTRUCTION IN THE FIVE HIGH SCHOOLS OF DENVER IN JUNE, 1915 ============================================================== East North South West Manual High High High High High School School School School School + -+ - + - + + - English I 23 15 11 9 31 English II 14 16 10 11 23 English III 16 3 2 15 20 English IV 3 1 2 8 13 Mathematics I 23 24 26 28 50 Mathematics II 17 21 28 20 19 Commercial arithmetic 46 16 33 Elementary science 13 9 14 21 7 Botany 21 14 14 14 24 Physics 10 15 18 17 34 Chemistry 0 4 14 6 20 Physiography 11 15 12 History Ancient 12 17 11 10 15 English 12 17 7 5 Medieval and modern 12 9 8 8 13 American 7 Latin I 22 16 10 29 40 Latin II 14 20 14 11 18 German I 20 15 24 5 19 German II 19 2 3 0 0 =============================================================="
Gutenberg,Bell__Thomas_J___Thomas_Jefferson___1852_-66130_Historyofthe.txt-7,Bell Thomas J  Thomas Jefferson  1852 ,,"TOTAL SIZE OF OWNER. DEPTH DEPTH BORE IN REMARKS. IN FEET. IN FEET. INCHES. -----------------+--------+--------+--------+-------------- 30 Hulsman 131 161 4 Bored to the rock. +--------+ Windisch, 4½ Driven to the Muhlhauser & Co. rock. 180 4½ +--------+ John Hauck 170 +--------+ 46 Emery Hotel. 40 60 146 3 From the --------+ cellar. W. W. Johnson. 12 68 80 3½ To the rock. --------+ City Infirmary. 12 13½ 6½ 15 15 Also another 29 92 3½ well 73 feet. =================+========+========+========+=============="
Gutenberg,Bell__Thomas_J___Thomas_Jefferson___1852_-66130_Historyofthe.txt-7,Bell Thomas J  Thomas Jefferson  1852 ,,"ARTESIAN WELLS. Beneath the Cincinnati group are the calciferous sand-rock and Potsdam sandstone, which are porous and water bearing, but they rise to the surface nowhere in our State. They have been reached, however, at this point in several of the deep well-borings, and flowing water of sulpho-saline nature was found, at the following locations: =========================+====================+==========+=============+ NAME OF OWNER. LOCATION. DEPTH SIZE OF BORE IN FEET. IN INCHES. -------------------------+--------------------+----------+-------------+ Rabe’s Distillery Cumminsville. 1,400 4½ Millcreek West of Millcreek. 1,440 4½ Cincinnati Gas Co West Front Street. 1,360 4½ 1,360 4½ Eastern Avenue. 1,475 6 Moerlein’s Brewery North Elm Street. 2,408 4 Keck’s Fertilizing Works Cumminsville. 1,380 -- =========================+====================+==========+=============+ =========================+==========+==========+========+============ CAPACITY NAME OF OWNER. DEPTH PRESSURE TEMPER- PER HOUR IN FEET. IN LBS. ATURE. IN GALLONS. -------------------------+----------+----------+--------+------------ Rabe’s Distillery 1,400 35 -- 6,000 Millcreek 1,440 45 -- 16,000 Cincinnati Gas Co 1,360 41 60 8,300 1,360 40 60 8,300 1,475 52 61 30,000 Moerlein’s Brewery 2,408 -- 62 24,000 Keck’s Fertilizing Works 1,380 -- 60 =========================+==========+==========+========+============ Through the kindness of Gen. A. Hickenlooper, President of the Cincinnati Gas Company, the following complete account of the borings at their works on Front Street is given, which will also serve for a description of the above artesian wells. The depth and classification of strata are: Filling 5 feet. Yellow clay 5 Blue clay 20 Sand and gravel 90 Soapstone 3 Blue limestone 40 Blue & gray limestone 50 Sandstone 5 Limestone 380 White limestone 240 Sandstone 65 Limestone, very hard 15 feet. Red sandstone 62 White sandstone 85 Coarse sandstone } 15 Coarse limestone } Sandstone 140 Very hard, flinty } limestone } Red and white } 25 marble } White marble or flint } -----"
Gutenberg,Bell__Thomas_J___Thomas_Jefferson___1852_-66130_Historyofthe.txt-7,Bell Thomas J  Thomas Jefferson  1852 ,,"GRAINS IN ONE U. S. GALLON. Carbonate of Lime 19.34 Carbonate of Magnesia 9.13 Chloride of Sodium 534.77 Chloride of Potassium 3.95 Chloride of Magnesia 17.26 Chloride of Calcium 22.19 Sulphate of Lime 29.20 Sulphate of Potash 2.30 Iodide of Magnesium 30 Bromide of Magnesium 39 Oxide of Iron 43 Phosphate of Soda 1.34 Silica 79 Loss in analysis 76 -------- Total 642.16 Prof. Newberry is of the opinion that soft water is improbable in these deep rocks. No. 3. WATER-SHED. The courses of our streams show at a glance that a water-shed crosses the State from north-east to south-west. This water-shed forms a range of highlands that slope by long and easy descent to the Ohio in the south, more rapidly to the lake in the north. This water-shed in its relief is almost insignificant, its average altitude being only 500 feet above the lake, its highest point rising perhaps 1,000 feet above the bottom valley of the Ohio. Our topographical features may therefore be described of a plain, slightly raised along a line traversing it from north-east to south-west. The following altitudes will show the topography of the northern divide. The levels are all above Lake Erie: ------------------+-----------------------------------------------------"
Gutenberg,Bell__Thomas_J___Thomas_Jefferson___1852_-66130_Historyofthe.txt-10,Bell Thomas J  Thomas Jefferson  1852 ,,"SUBTERRANEAN WATER RESOURCES. Underlying our drift formation is that impervious strata of blue limestone, 1,000 feet in thickness, through which no water can circulate. The lowest limit of this mass of stone is at low water of the Ohio River, at Cincinnati, from which point it anticlines in all directions. There are crevices or pockets, however, in which water has been accidentally found. The following are examples: ===================+==============+=====================+======+ NAME OF OWNER. LOCATION. FORMATION. DEPTH IN FEET. -------------------+--------------+---------------------+------+ John Kaufman. Vine Street. Blue clay. 25 Sand and quicksand. 73 Blue clay. 55 Quicksand and gravel. 35 Limestone. 25 Soil and quicksand. 75 Holder’s Tannery. Colerain Pike. Clay. 90 Limestone. 50 Alluvial and gravel. 80 Freiburg & Workum. Main Street. Limestone. 170 ===================+==============+=====================+======+ ===================+======+========+==========+=========== TOTAL DIAMETER NAME OF OWNER. DEPTH DEPTH OF WHERE WATER IN OF WELL BORING WAS FOUND. FEET. IN FEET. IN INCHES. -------------------+------+--------+----------+----------- John Kaufman. 25 73 55 35 25 215 3½ In crevice. 75 Holder’s Tannery. 90 50 215 3½ 80 Freiburg & Workum. 170 250 -- In crevice. ===================+======+========+==========+==========="
Gutenberg,Bell__Thomas_J___Thomas_Jefferson___1852_-66130_Historyofthe.txt-10,Bell Thomas J  Thomas Jefferson  1852 ,,"OWNER. LOCATION. FORMATION. DEPTH IN FEET. -----------------+-------------+-------------------+--------+ Fill. 30 Hulsman W. S. John, Blue clay. } near Lib’ty. Quicksand. } 131 Gravel. } +--------+ Windisch, Brewery on Sand. } Muhlhauser & Co. the Canal Quicksand. } Gravel. } Sand. } +--------+ John Hauck Brewery on Quicksand, yellow.} Dayton St. blue. } +--------+ Gravel. 46 Blue Clay. } Emery Hotel. Vine St. bet. Black mud. } 4th and 5th. Quicksand. } 40 Gravel. 60 +--------+ W. W. Johnson. Sycamore & Alluvial. 12 Yeatman. Gravel. 68 +--------+ City Infirmary. Hartwell. Black loam. 12 Blue clay. 13½ Blue clay mixed } with gravel. } 6½ Bowlder gravel. 15 Quicksand. 15 Gravel. 29 =================+=============+===================+========+ =================+========+========+========+============== TOTAL SIZE OF OWNER. DEPTH DEPTH BORE IN REMARKS. IN FEET. IN FEET. INCHES. -----------------+--------+--------+--------+-------------- 30 Hulsman 131 161 4 Bored to the rock. +--------+ Windisch, 4½ Driven to the Muhlhauser & Co. rock. 180 4½ +--------+ John Hauck 170 +--------+ 46 Emery Hotel. 40 60 146 3 From the --------+ cellar. W. W. Johnson. 12 68 80 3½ To the rock. --------+ City Infirmary. 12 13½ 6½ 15 15 Also another 29 92 3½ well 73 feet. =================+========+========+========+=============="
Gutenberg,Bell__Thomas_J___Thomas_Jefferson___1852_-66130_Historyofthe.txt-5,Bell Thomas J  Thomas Jefferson  1852 ,,REDUCTION BY OXIDATION IN RUNNING WATER. --------+--------------+-----------+--------------------------------- PERCENTAGE OF REDUCTION OF NAME OF LENGTH OF FLOW TEMPERATURE ORGANIC ELEMENT. RIVER. IN MILES. CENTIGRADE.+---------------+----------------- IN ORG. CARBON. IN ORG. NITROGEN. --------+--------------+-----------+---------------+----------------- Irwell 11 6 to 8 4.5 0 11 12 0 11.8 11 17 29.6 0 Mersey 13 4 to 4.8 20.8 17.9 Darwin 13 6.8 to 10 0 13.2. --------+--------------+-----------+---------------+-----------------
Gutenberg,Gaskell__Walter_Holbrook-44000_TheOriginof.txt-15,Gaskell Walter Holbrook,,"TABLE OF COMPARISON OF CORRESPONDING SEGMENTS IN THE EURYPTERIDS AND IN AMMOCOETES (i.e. IN CEPHALASPIDS). Key: So. = Supra-oesophageal. Si. = Supra-infundibular. Io. = Infra-oesophageal. Ii. = Infra-infundibular. Ps. = Prosomatic. Ms. = Mesosomatic. +---+--------------------------------------------------------+ Median Eyes. +--------------------------------------------------------+ So. Lateral Eyes. +--------------------------------------------------------+ Camerostome. +---+--------------------------------------------------------+ Invertebrate (Limulus or Eurypterid). +---+---+---------+-----------------------------+------------+ Appendages. Coelomic Segments.+-------------+---------------+ Cavities. Limulus. Eurypterid. +---------+-------------+---------------+------------+ 1 Cheliceræ Cheliceræ 1 +---------+-------------+---------------+------------+ 2 1st Locomotor } +---------+-------------+} 2 3 2nd "" } Ventral part Ps.+---------+-------------+}4 Endognaths forms coxal 4 3rd "" } gland. +---------+-------------+} 5 4th "" } +---------+-------------+---------------+------------+ Io. 6 5th "" Ectognath 3 +---------+-------------+---------------+------------+ 7 Chilaria Metastoma 4 +---+---------+-------------+---------------+------------+ 8 Operculum Genital } 5 ---------+-------------+ }Oper-+------------+ 9 1st Branchial }culum 6 Branchial} Ms.+---------+-------------+---------------+------------+ 10 2nd "" 2nd Branchial 7 +---+---+---------+-------------+---------------+------------+ +-----------------------------------------------------+------+ Pineal Eyes. +-----------------------------------------------------+ Lateral Eyes. Si. +-----------------------------------------------------+ Olfactory Organ. +-----------------------------------------------------+------+ Vertebrate (Ammocoetes or Cephalaspid). +-------------+---------------+-------------+---------+------+ Splanchnic Somatic Somatic Appendages. Nerves. Segmental Nerves. Muscles. +-------------+---------------+-------------+---------+ ... ... ... ... +-------------+---------------+-------------+---------+ V Muscles 4 tentacles Tentacular supplied by III and upper and upper oculomotor lip. lip nerve. nerve. +-------------+---------------+-------------+---------+ Tongue V Sup.oblique IV Ii. Tongue nerve +-------------+---------------+-------------+---------+ Lower lip V Lower lip nerve +-------------+---------------+-------------+---------+ Thyroid } +-------------+} VII Ext. rectus VI Hyoid or } Retract oculi 1st Branchial } +-------------+---------------+-------------+---------+ 2nd Branchial IX ... ... +-------------+---------------+-------------+---------+------+ +-------------------------+------+ Pineal Nerve. +-------------------------+ II Si. +-------------------------+ I +-------------------------+------+ Vertebrate. +-------------+-----------+------+ Coelomic V. Wijhe's Cavities. Segments. +-------------+-----------+ Anterior. ... +-------------+-----------+ Premandi- bular Ventral part forms 1 pituitary body. pituitary +-------------+-----------+ Mandibular } Ii. } +-------------+} 2 Mandibular } } +-------------+-----------+ Hyoid1 3 +-------------+-----------+ Hyoid2 4 +-------------+-----------+ 2nd Branchial 5 +-------------+-----------+------"
Gutenberg,Adams__Alton_D_-48134_ElectricTransmissionof.txt-4,Adams Alton D ,,CIRCUITS IN TRANSMISSION LINES. +----------------------------+------+------+------+----------+--------+ Cycles Length Number Number Circular per Location of Lines. in of of Mils Second Miles. Cir- Pole per of cuits. Lines. Wire. Current. +----------------------------+------+------+------+----------+--------
Gutenberg,Iyenaga__T___Toyokichi_-36822_Japanandthe.txt-11,Iyenaga T  Toyokichi ,,"NUMBER OF JAPANESE IN CALIFORNIA ACCORDING TO THE UNITED STATES CENSUS. =========================================== Year. Number. Decennial Percentage of Increase. Decennial Increase. ----- ------- --------- ------------------- 1880 86 ..... ....... 1890 1,147 1,061 1,234 % 1900 10,151 9,004 785 % 1910 41,356 31,205 307.3% 1920 70,196 28,840 69.7% =========================================== We see from the above table that after half a century of Japanese immigration to the United States, California's net gain amounts to a little over 70,000, the number having increased at an average rate of 14,025 per decade, or 1603 per annum. We also observe that the percentage of decennial increase gradually decreased from 1234 per cent. to 69.7 per cent. It is useful to compare this development of the Japanese population with that of California in general, because it gives an idea of the relative importance of the Japanese increase. This is shown in the following table, in which the decennial rates of increase between them are compared: COMPARISON OF POPULATION INCREASE OF CALIFORNIA AND OF JAPANESE IN CALIFORNIA. ================================================================== Year. Number. Decennial Rate of Rate of Percentage of Increase. Decennial Japanese Japanese to the Increase. Decennial Total Population Increase. of California. ----- ----------- ----------- --------- --------- ---------------- 1880 864,694 ......... .... .... .0099% 1890 1,213,398 348,704 40.3% 1234 % .095 % 1900 1,485,053 271,655 22.3% 785 % .68 % 1910 2,377,549 892,496 60.0% 307.3% 1.73 % 1920 3,426,861 1,049,312 44.1% 69.7% 2.04 % =================================================================="
Gutenberg,Iyenaga__T___Toyokichi_-36822_Japanandthe.txt-11,Iyenaga T  Toyokichi ,,"JAPANESE POPULATION IN THE UNITED STATES AND CALIFORNIA. ===================================================================== Census. Japanese in Decennial Rate of Rate of Percentage of Continental Increase of Decennial Decennial Japanese in United Japanese in Increase. Increase of California to States. Continental Japanese in entire Japanese United California. population of States. United States. ------------------- ----------- --------- ----------- --------------- 1880 148 ...... ....... ...... 58.1% 1890 2,039 1,891 1,277.7% 1234.0% 56.2% 1900 24,326 22,287 1,093.0% 785.0% 41.7% 1910 72,157 47,831 196.6% 307.3% 57.3% 1920 119,207 47,050 65.2% 69.7% 58.8% ====================================================================="
Gutenberg,Iyenaga__T___Toyokichi_-36822_Japanandthe.txt-8,Iyenaga T  Toyokichi ,,DEATH RATE OF JAPANESE IN CALIFORNIA. ======================== Year. Number. Percentage of Death per 1000. ----- ------- ---------- 1910 440 10.64% 1911 472 ..... 1912 524 ..... 1913 613 ..... 1914 628 ..... 1915 663 ..... 1916 739 ..... 1917 910 ..... 1918 1150 ..... 1919 1360 20.00% ========================
Gutenberg,Iyenaga__T___Toyokichi_-36822_Japanandthe.txt-19,Iyenaga T  Toyokichi ,,DEATH RATE OF JAPANESE IN CALIFORNIA. ======================== Year. Number. Percentage of Death per 1000. ----- ------- ---------- 1910 440 10.64% 1911 472 ..... 1912 524 ..... 1913 613 ..... 1914 628 ..... 1915 663 ..... 1916 739 ..... 1917 910 ..... 1918 1150 ..... 1919 1360 20.00% ========================
Gutenberg,Stephenson__Andrew-12638_PublicLandsand.txt-14,Stephenson Andrew,,"CIVIC COLONIES. -----------+---------+------+------------+---------+-----------+----------- NO. OF NO. OF TOTAL NO. COLONIES. PLACE DATE. COLONISTS. JUG. TO OF JUG. ACRES. EACH. -----------+---------+------+------------+---------+-----------+----------- Labici. Latium. 418 1500 2 3000 1875 -----------+---------+------+------------+---------+-----------+----------- LATIN COLONIES. -----------+---------+------+------------+---------+-----------+----------- Ardea. Latium. 442 300 2 600 375 Satricum. "" 385 300 2 600 375 Sutrium. Etruria. 383 300 2 600 375 Nepete. "" 383 300 4 1200 750 Setia. Latium. 382 300 4 1200 750 -----------+---------+------+------------+---------+-----------+----------- Total 7200 4500 -----------------------------------------+---------+-----------+-----------"
